Sheet: TPS92518
A1: Inputs
A2: V_in | B2: 24 | C2: V
A3: I_out | B3: 1.5 | C3: A
A4: V_out | B4: of:=3*5 -> 15 | C4: V
A5: V_out_min | B5: of:=2.5*5 -> 12.5 | C5: V
A6: r | B6: 0.1
A7: f | B7: 1000000 | C7: Hz
A8: Qg | B8: 0.000000026 | C8: C
A9: V_IN-RISE-THRESHOLD | B9: 22 | C9: V
A10: V_HYST | B10: 2 | C10: V
A12: Calculations | D12: Chosen Value
A13: Duty cycle | B13: of:=[.B4]/([.B2]*0.916) -> 0.682314410480349
A14: I_pp | B14: of:=[.B6]*[.B3] -> 0.15 | C14: A
A15: t_OFF | B15: of:=(1/([.B7]))*(1-[.B13]) -> 0.00000031768558951965 | C15: s (ns)
A16: LEDx_TOFF_DAC | B16: of:=[.B15]*2136000*[.B4] -> 10.1786462882096
A17: L | B17: of:=([.B15]*[.B4])/[.B14] -> 0.0000317685589519651 | C17: H (µH) | D17: 0.000068 | E17: H (µH)
A18: I_Lx-peak | B18: of:=[.B3]+([.B14]/2) -> 1.575 | C18: A
A19: R_sense | B19: of:=255/(1000*[.B18]) -> 0.161904761904762 | C19: Ω | D19: 0.1 | E19: Ω
A20: R_sense_power | B20: of:=([.B18]*[.B18])*[.B19] -> 0.401625 | C20: W
A22: f_SW-MAX | B22: of:=[.B5]/([.B2]*0.000000235) -> 2216312.05673759 | C22: Hz (MHz)
A23: t_OFF-MIN | B23: of:=([.B14]*[.B17])/[.B4] -> 0.00000031768558951965 | C23: s (us)
A24: LEDx_TOFF_DAC_MIN | B24: of:=[.B23]*[.B4]*2136000 -> 10.1786462882096 | D24: 16
A25: C_BOOT | B25: of:=([.B8]+(0.0002*0.0005))/(7.5-0.4-5.2) -> 0.00000006631578947368 | C25: F (nF)
A27: R5 | B27: of:=([.B10]-(((0.1*[.B9])-0.124)/1.24)-0.1)/0.000018 -> 12544.8028673835 | C27: Ω | D27: 12400 | E27: Ω
A28: R6 | B28: of:=(1.24*[.B27])/([.B9]-1.24) -> 749.30421751231 | C28: Ω | D28: 750 | E28: Ω

Sheet: TPS56339
A1: Inputs
A2: Vin | B2: 24 | C2: V
A3: Vout | B3: 12 | C3: V
A4: Iout | B4: 1 | C4: A
A5: R105 | B5: 10000 | C5: Ω (kΩ)
A6: Vref | B6: 0.802 | C6: V
A7: r | B7: 0.2
A8: f | B8: 500000 | C8: Hz (kHz)
A9: C_IN | B9: of:=0.0000032 -> 0.0000032 | C9: F (µF)
A10: Cin_ESR_max | B10: 0.01 | C10: Ω (mΩ)
A11: Vstart | B11: 22 | C11: V
A12: Vstop | B12: 20 | C12: V
A13: V_en_fall | B13: 1.12 | C13: V
A14: V_en_rise | B14: 1.18 | C14: V
A15: Ip | B15: 0.0000012 | C15: A (µA)
A16: Ih | B16: 0.0000031 | C16: A (µA)
A18: Calculations
A19: R104 | B19: of:=[.B5]*([.B3]-[.B6])/[.B6] -> 139625.935162095 | C19: Ω (kΩ) | D19: 140000 | E19: Ω (kΩ)
A20: L | B20: of:=([.$B$3]/[.$B$2])*(([.$B$2]-[.$B$3])/([.$B$7]*[.$B$4]*[.$B$8])) -> 0.00006 | C20: H (µH) | D20: 0.000068 | E20: H (µH)
A21: I_ripple | B21: of:=([.$B$3]/[.$B$2])*(([.$B$2]-[.$B$3])/([.B20]*[.$B$8])) -> 0.2 | C21: A (mA)
A22: I_Cout_rms | B22: of:=([.B3]*([.B2]-[.B3]))/(SQRT(12)*[.B2]*[.B20]*[.B8]) -> 0.0577350269189626 | C22: A
A23: I_Cin_rms | B23: of:=[.B4]*SQRT(([.$B$3]/[.$B$2])*(([.$B$2]-[.$B$3])/[.B2])) -> 0.5 | C23: A (mA)
A24: dVIN | B24: of:=([.B4]*0.25)/([.B9]*[.B8])+([.B4]*[.B10]) -> 0.16625 | C24: V (mV)
A25: UVLO_R101 | B25: of:=(((([.B11]*([.B13]/[.B14]))-[.B12])/([.B15]*(1-([.B13]/[.B14]))+[.B16]))) -> 278820.375335121 | C25: Ω (kΩ) | D25: 270000 | E25: Ω (kΩ)
A26: UVLO_R102 | B26: of:=([.B25]*[.B13])/([.B12]-[.B13]+[.B25]*([.B15]+[.B16])) -> 15552.5646777329 | C26: Ω (kΩ) | D26: 15400 | E26: Ω (kΩ)

Sheet: LED Voltage
A1: 2.4 | B1: 0.024
A2: 2.5 | B2: 0.122
A3: 2.55 | B3: 0.269
A4: 2.6 | B4: 0.499
A5: 2.65 | B5: 1.9
A6: 2.7 | B6: 3.6
A7: 2.75 | B7: 5
A8: 2.8 | B8: 7.5
A9: 2.85 | B9: 10
A10: 2.9 | B10: 13
A11: 2.95 | B11: 16
A12: 3 | B12: 20
A13: 3.05 | B13: 23
A14: 3.1 | B14: 27
A15: 3.2 | B15: 36
A16: 3.3 | B16: 45
A17: 3.4 | B17: 58
A18: 3.5 | B18: 72